,Title,Price,ColoursAvailable,ReviewTopic,Reviews,UserID,Date,VerifiedPurchaser,IncentivizedReview
105,NMD_R1 Shoes,150,3,Disappointing,I am a true womens 8.5. These were extremely large and more like a 10 or 10.5. Told customer service I thought it was a manufacturing issue. They didn’t do anything but tell me to return and could not try in another size or get another pair sent since they were out of stock.,Kids1 ," July 17, 2023 ",False,True
106,NMD_R1 Shoes,150,3,Too stiff,"Super stiff shoe, couldn’t even put on. The color is nice.",Mari ," July 17, 2023 ",False,True
112,NMD_R1 Shoes,150,3,Got what I ordered!,Good choice I’m pleased with them for now. Too much too write let me decide,Mad36560 ," July 16, 2023 ",False,True
113,NMD_R1 Shoes,150,3,Great shoe,I’ve owned several other pairs of these and these live up to the comfort and fit of past pairs. Love the color combination.,Klb121 ," July 15, 2023",False,False
114,NMD_R1 Shoes,150,3,Best Adidas design thus far !,"I bought a 7.5 thinking they would run a lil small, but I was wrong 🤦‍♀️ I just put a couple of running soles &amp; they fit great ! So many compliments and... here's a lil secret - you can wrap the sneakers in a white towel &amp; throw them in the wash, hot water with Oxy Tide Pod. Comes out brand new. Then air dry !",Bostonisthegreatestcityon ," July 15, 2023",False,False
115,NMD_R1 Shoes,150,3,Very comfortable,Good looking shoe with all day comfort. Highly recommend.,Bella ," July 15, 2023",False,False
116,NMD_R1 Shoes,150,3,Great shoe,I love the shoe but the shoe runs big. I need a half size small.   It just take too long to return.,ZoJax ," July 13, 2023 ",False,True
117,NMD_R1 Shoes,150,3,Great product,"I love my new adidas the colors are beautiful, good price the app is easy to use, would definitely recommend adidas to everyone , thank you",Leanie ," July 10, 2023 ",False,True
118,NMD_R1 Shoes,150,3,Most comfortable shoes ever!,"I love these shoes, they’re all black so they go with everything. Would buy again and again !",Chels ," July 10, 2023",False,False
119,NMD_R1 Shoes,150,3,Unhappy,"I returned the product because it was
Faulty.
Requested a refund and have been waiting almost a month now to receive my refund.",Lexis ," July 10, 2023 ",False,True
120,NMD_R1 Shoes,150,3,Great shoe want to buy more!,Need more color options. Looking for highlighter orange,BigRay ," July 10, 2023",False,False
121,NMD_R1 Shoes,150,3,great for long travel days with lots of walking,Need more color ways and restock in smaller sizes!,LiLi87 ," July 10, 2023",False,False
122,NMD_R1 Shoes,150,3,Good shoe,The fit isa bit big so i would say size down half a size other than that is a great shoe,Celia6455 ," July 10, 2023",False,False
123,NMD_R1 Shoes,150,3,Great shoes just hard to put ur foot in it,Comfort and size wise it’s a great shoe. You just have to relax and have an extra time to put your foot in it. It may take a while depends on ur size but once it’s in it’s perfect. I dont know if it’s gonna change once it breaks in but yeah the tough part is putting ur foot in.,JV28 ," July 9, 2023",False,False
124,NMD_R1 Shoes,150,3,Good,It is hard to put my feet in and the fabric is not comfortable,Gdrea ," July 9, 2023 ",False,True
125,NMD_R1 Shoes,150,3,"Way too big, not true to size.","love them, but they are 2 sizes too big. Normally wear a 7.5 they fit like an 8.5",Ashley ," July 9, 2023 ",False,True
126,NMD_R1 Shoes,150,3,Comfortable!!,Comfortable standing/walking around as an everyday use shoe,Wayway ," July 9, 2023 ",False,True
132,NMD_R1 Shoes,150,3,"Need flap to ease, inserting the leg","Putting the leg is tricky
Rest is good. Good shoes",Pree ," July 6, 2023",False,False
133,NMD_R1 Shoes,150,3,Amazing product,Nothing more to say it’s just amazing love everything,Yesser ," July 5, 2023",False,False
134,NMD_R1 Shoes,150,3,Nice Purchase,Confortable and nice looking shoes. Usually wear them when traveling.,Cisco ," July 5, 2023 ",False,True
135,NMD_R1 Shoes,150,3,BEST NMDS,Super comfy!!! Wear these to work!!!!! I love NMDS,Monikillz ," July 4, 2023 ",False,True
136,NMD_R1 Shoes,150,3,"Love the colors, so comfortable!",The shoes for very comfortably. I like how there are so many color options to choose from. Sometimes you don’t know what to expect when you order online but I was pleasantly surprised with this purchase.,Carla7 ," July 4, 2023 ",False,True
137,NMD_R1 Shoes,150,3,8,They are very nice but it's too big  I love the color,Gail ," July 4, 2023",False,False
138,NMD_R1 Shoes,150,3,Amazing,Happy great buy i love it everything i bought from adidas always fit correctly,Mike1992 ," July 4, 2023",False,False
139,NMD_R1 Shoes,150,3,Good quality shoes,It’s really good shoes but little bit in size you need go size down,Lola ," July 4, 2023",False,False
140,NMD_R1 Shoes,150,3,My New Favorite,"I love these shoes! They’re light, flexible and so comfortable like you’re walking on a cloud.",ThicknThin4 ," July 3, 2023 ",False,True
141,NMD_R1 Shoes,150,3,Comfortable,Comfortable shoes but I wish they would stock sizes more often,Jmg90 ," July 3, 2023",False,False
142,NMD_R1 Shoes,150,3,Definitely recommend,Very comfortable and cute. Love them for walking and the colors are perfect,Lola ," July 1, 2023 ",False,True
143,NMD_R1 Shoes,150,3,Very comfortable and stylish,Very comfortable and stylish. Matches lots of different outfits.,FrugalCactus ," July 1, 2023 ",False,True
144,NMD_R1 Shoes,150,3,way too wide,These shoes are very wide. If you have narrow feet I would not recommend.,JMH2023 ," July 1, 2023",False,False
145,NMD_R1 Shoes,150,3,Wonderful,Size too big other than that shoe is amazing will recommend,Fab2332 ," July 1, 2023 ",False,True
146,NMD_R1 Shoes,150,3,My new favs shoe,"These are comfortable and I can be on my feet for hours. I normally wear a size 7 but with Adidas always a 6/12! Delivery was practically next day, very happy with these new shoes.",Apain ," July 1, 2023 ",False,True
148,NMD_R1 Shoes,150,3,Good shoes! Nice comfort,I would recommend this product to people who use it on a daily basis.,Amii ," June 30, 2023",False,False
149,NMD_R1 Shoes,150,3,Adidas NMDs are the best shoes.,"Adidas NMDs are stylish and comfortable. I have a lot of shoes and more than half of them are NMDs, I love them",Sarah:) ," June 30, 2023",False,False
150,NMD_R1 Shoes,150,3,Greatly comfortable,Love the color. Great walking shoe. And everyday shoe,Beli ," June 30, 2023",False,False
151,NMD_R1 Shoes,150,3,Dream shoes!!!!,Purchasing the shoes was fairly easy once I realized the payment option of Apple Pay was working!,Hannah ," June 30, 2023 ",False,True
152,NMD_R1 Shoes,150,3,I love the material and the simple color combo!,The material of the shoe is breathe-able and easy to clean. Also the simple all black color with just a touch of color is the perfect for an every day shoe!,Liddocuzzin ," June 29, 2023",False,False
153,NMD_R1 Shoes,150,3,Love! Always last me a long time and super comfy,Always have to have these pairs in my closet! Love them!,Cast97 ," June 29, 2023",False,False
154,NMD_R1 Shoes,150,3,Great quality and comfort.,I bought these shoes for my wife and she absolutely loves them.  Shes already asked for more pairs in different sizes.   Will definitely purchase more.,TravisN23 ," June 29, 2023",False,False
155,NMD_R1 Shoes,150,3,Love nmds best shoes,So many color options love all of them! 10 pairs and counting for me!,Duff ," June 29, 2023",False,False
156,NMD_R1 Shoes,150,3,Comfortable and fashionable !,"NMD is my favorite style! 
Fashion meets comfort. It’s not a bulky shoe so you can dress it up or rock the sporty look.",TeamTGC ," June 29, 2023 ",True,True
157,NMD_R1 Shoes,150,3,Comfy shoes,"I’m an er nurse , and these shoes are very comfy at work.",Courts816 ," June 28, 2023 ",False,True
158,NMD_R1 Shoes,150,3,Good Quality and fast delivery in every order.,Very fast service of delivery when I purchase Adidas shoes.,Matrix321 ," June 28, 2023",False,False
159,NMD_R1 Shoes,150,3,Y’all sent me worn and dirty shoes,"I received a pain of dirty, scuffed, and clearly worn shoes. Disgusting.",Beth ," June 27, 2023",False,False
160,NMD_R1 Shoes,150,3,Cousin loves the black and pink color and comfy,Would recommend again to a family or friend again.,Adrian22 ," June 27, 2023",False,False
161,NMD_R1 Shoes,150,3,Nice shoe for everyday wear,little too narrow but otherwise like them very much,nat2117 ," June 27, 2023",False,False
162,NMD_R1 Shoes,150,3,they run big,They are wide and I'm normally a size 9 and these were too big,miriam ," June 27, 2023 ",False,True
163,NMD_R1 Shoes,150,3,I prefer the kids version. More room for your feet,I couldn’t get my feet into the sneakers. Too narrow of an entry,KayJay ," June 27, 2023",False,False
164,NMD_R1 Shoes,150,3,"Overall design is nice, but too narrow for me","Look/appearance of shoe is nice and sleek, have purchased NMDs in the past and have loved them. However, this specific model was very stiff and the shoe opening was too narrow for my foot.  It took some work to get on and after wearing the shoes all day, the top of my feet started hurting.  Maybe these are just meant for narrow feet. I was very bummed, but I had to return.",PattyV14 ," June 26, 2023",False,False
165,NMD_R1 Shoes,150,3,Love my nmds,"Nmds are my fav
 They aren't soft and squishy but aren't hard as a rock. I love the firmness and support of them. My foot doesn't ache at the end of the day like it does with the squishier models",Nmdlover ," June 26, 2023",False,False
166,NMD_R1 Shoes,150,3,Love this product,It inspires my style. I want to get a full setup for this,CashOut04 ," June 26, 2023",False,False
168,NMD_R1 Shoes,150,3,Perfect size and fit,"The color stood out, the sole is balanced and the inside is quite comfortable.",Darhmi ," June 26, 2023 ",False,True
169,NMD_R1 Shoes,150,3,Dope colorway! Very comfortable for walking.,Best purchase ever! They match any outfit and are easy to put on.,Lance23 ," June 26, 2023",False,False
170,NMD_R1 Shoes,150,3,Confortable and beautiful,"Adidas is the best in sport, i love your style everything",Vane ," June 25, 2023",False,False
171,NMD_R1 Shoes,150,3,Fits differently than the Ultra Boost.,I like the color and shape of it. I have had many Adidas but for some reason this one  from day one gave me blisters on the back of my feet.  I was only walking not even working out.  I am very bummed because now I have to keep them since wore twice for like 15-20 min each.,Murru ," June 25, 2023 ",False,True
172,NMD_R1 Shoes,150,3,Very comfy but they get dirty quickly,"I love these shoes so much, I just wish they didn’t get dirty so quickly because dirt stays in the fabric and it’s hard to get out",Vanessa18 ," June 25, 2023",False,False
173,NMD_R1 Shoes,150,3,Wife loves them,My wife loves these she wears them everywhere she goes when she has to walk for long periods of time,Rayrisa ," June 24, 2023",False,False
174,NMD_R1 Shoes,150,3,Love the structure of the shoe. Very comfortable.,Very comfortable and stylish sneaker. Normally I wear a 6 but had to size down to a 5.5. Waited a while for the sneaker to be available in my size but the wait was worth it.,Gigi26 ," June 24, 2023",False,False
175,NMD_R1 Shoes,150,3,I always love getting new adidas shoes.,I liked the comfort in them. And how good of a deal I got on them.,SC11 ," June 23, 2023",False,False
176,NMD_R1 Shoes,150,3,Love,Color way is dope and perfect fit will. Buy more love adidas,Dipset ," June 23, 2023",False,False
177,NMD_R1 Shoes,150,3,Love these! Most comfortable sneaker ever!,I've bought at least 4 pair of these! Super comfortable!,KimberlyB ," June 23, 2023",False,False
178,NMD_R1 Shoes,150,3,Not the greats shoes. Hard to put on.,Not comfortable at all. Very hard to put on. They run big.,karinaj ," June 22, 2023 ",True,True
179,NMD_R1 Shoes,150,3,Not comfortable,"The shoes are super uncomfortable, it hurts my ankle in the back, have to return them.",sidfha ," June 22, 2023",False,False
180,NMD_R1 Shoes,150,3,Happy with my purchase,Comfortable shoes. I own them in every color and never am disappointed,Dootz ," June 21, 2023",False,False
181,NMD_R1 Shoes,150,3,Very awesome,The shoes are very stylish and not too flashy. However the comfort is out of this world!,Amanduh88 ," June 21, 2023 ",False,True
182,NMD_R1 Shoes,150,3,I love the design and shoes.,"They are so comfortable! 
I recommend this shoes! You are going to love them!",Chacho ," June 20, 2023",False,False
183,NMD_R1 Shoes,150,3,Awesome,"Love it, super comfy and matches with everything. Adidas is my #1",Ash387 ," June 20, 2023 ",False,True
184,NMD_R1 Shoes,150,3,My mom bought then and loves them,I like the the way they look and how clean they are,Bman002 ," June 20, 2023",False,False
185,NMD_R1 Shoes,150,3,Best ever,I love it it my favorite thing ever I want to buy morr,Ashley ," June 20, 2023",False,False
186,NMD_R1 Shoes,150,3,Best purchase,"In love with the color of this shoes, the fill confortable.",Vane1993 ," June 19, 2023",False,False
188,NMD_R1 Shoes,150,3,The best,Great Colab shoes unique designed. The box presentation is the best ever,Ramdrive ," June 19, 2023",False,False
189,NMD_R1 Shoes,150,3,The perfect black sneaker!,"The perfect black sneaker, which made me a new adidas addict. Haha.",Starlight ," June 19, 2023 ",False,True
190,NMD_R1 Shoes,150,3,Very cool but size down 0.5,Super cool looking. Massive amounts of boost - prime knit is super soft. Fits 0.5 size too big. Awesome shoe,James ," June 19, 2023",False,False
191,NMD_R1 Shoes,150,3,Super cute and extremely comfortable!,Love that they go with everything and are supper comfortable!,Dgilmore ," June 19, 2023",False,False
193,NMD_R1 Shoes,150,3,Cute shoes but slightly uncomfortable,"Very cute sneakers! The only complaint I have is that the tongue is hard and it kept digging into the front of my ankle. Other than that,  I've worn it and walked around the airport and Universal Studio all day so I'd say it is very walkable!",charlieyun ," June 18, 2023 ",False,True
194,NMD_R1 Shoes,150,3,Disappointed,"Had a picture in my phone of this for so long to purchase. I finally did, and I was disappointed. It was too big and I bought it based on the size chart plus the colour was nothing like online. Will be returning.",patricewilliams117 ," June 18, 2023 ",False,True
195,NMD_R1 Shoes,150,3,Better to try them on before purchasing,I could hardly put them on because of the one-piece construction. But the size was bigger,Lucy30 ," June 18, 2023 ",False,True
196,NMD_R1 Shoes,150,3,Best,Love the shoes so pretty and confort I loved I walking,Erwinjoel ," June 18, 2023",False,False
202,NMD_R1 Shoes,150,3,This is actually very comfortable to use.,This shoes is pretty nice but it runs big. I would size down if you are planing to get one. Very comfortable,Mikie ," June 17, 2023",False,False
203,NMD_R1 Shoes,150,3,comfy fir everyday use to walk,it is just fit my wide feet.and light to ealk with and the color i love it,dinz ," June 16, 2023 ",False,True
204,NMD_R1 Shoes,150,3,Great shoe my second time getting it!!,Once again Awesome shoe will definitely be buying it again. Very comfortable footwear. One of the best,Baysgod ," June 16, 2023",False,False
205,NMD_R1 Shoes,150,3,Love them,I would highly recommend these to anyone they are so comfortable,Maroon ," June 16, 2023",False,False
206,NMD_R1 Shoes,150,3,Love these shoesss,"Love these shoes, they are the perfect fit width wise and aren’t too tight on the top off my feet. They are my work shoes at a doctors office.",Lexirae7 ," June 16, 2023 ",False,True
207,NMD_R1 Shoes,150,3,Definitely would recommend,Soft cushiony sole and great for work environments that in love a lot of steps,oh45 ," June 15, 2023",False,False
208,NMD_R1 Shoes,150,3,Worst pair of shoe I ever owned,"Probably the worst pair of shoe for the price I paid. The sole is thin, so it’s not suitable for a walking. My feet would hurt after 1 hour. The lace is constantly loosened on its own. On top of that, it gives me blisters if I wear my ankle socks. I don’t know what all the hype is about. Big regret on my purchase.",Djsm ," June 15, 2023",False,False
209,NMD_R1 Shoes,150,3,Best purchase ever!,Love my NMD'S. Specially the color and the comfort.💗,Luvnla ," June 15, 2023 ",False,True
210,NMD_R1 Shoes,150,3,Where’s the support on the bottom of the shoe?,"Had a friend recommend these ‘comfy’ shoes. They’re cute but if you wear these to an 8 hour shift which is the reason i bought them for in the first place, you’re gonna be in pain after 2 hours. They dont have much support on the bottom unfortunately. But for casual use it’s fine.",Yyyy ," June 14, 2023",False,False
211,NMD_R1 Shoes,150,3,Very pretty!!,"Very comfortable, I love them, so pretty color as well !!",Cindy_dguez98 ," June 14, 2023",False,False
212,NMD_R1 Shoes,150,3,Nice shoes,"Perfect fit for my shoes ,,,,,,,,,,,,,,,,,,,,,,,,,,",Elmar ," June 14, 2023",False,False
213,NMD_R1 Shoes,150,3,Great,"Great and amazing
The clothing and the shoes fit very nicely",Emmers ," June 14, 2023",False,False
214,NMD_R1 Shoes,150,3,Comfortable shoes,Good shoes and very comfortable. They look stylish.,Jess90 ," June 13, 2023",False,False
215,NMD_R1 Shoes,150,3,My wife loves them,Bought them for my wife’s birthday my daughter has a pair also,Hart33 ," June 13, 2023 ",False,True
216,NMD_R1 Shoes,150,3,They look great. Perfect shade of green.,I love the way they look. They could use more support under the ball of the foot.,NOLA_Angel ," June 13, 2023",False,False
219,NMD_R1 Shoes,150,3,Will buy Again,Very comfortable shoes and I love the color  green,Justme ," June 13, 2023 ",False,True
220,NMD_R1 Shoes,150,3,Beautiful slip on but hurts a lot,"Beautiful slip on, but hurts on the heel. It’s impossible to use w/ no show socks. Even if you use w/ regular/comfy socks, it’s still unconfortable.
I tried to wear during a trip, but by the end of the day the pain is unbearable. 
Great material used outside X poor finish inside.
Not comfort at all.",paulastan ," June 13, 2023 ",False,True
221,NMD_R1 Shoes,150,3,Perfect fit,Fits perfect and looks great. Bought same shoe different since they are so comfy to wear.,Nani ," June 13, 2023 ",False,True
222,NMD_R1 Shoes,150,3,Loved,I love the fit and color I get  many comments and n how they love the color and they ask where do you get those shoes.,Jammii ," June 13, 2023",False,False
223,NMD_R1 Shoes,150,3,Best purchase,"Color was nice, very comfortable 
I love it, my favorites",Iriano ," June 12, 2023",False,False
224,NMD_R1 Shoes,150,3,Sweet kicks.,I love the NMD-R1’s. I bought 7 pairs and they’re all beautiful and super comfortable.,MaddyZ ," June 12, 2023 ",False,True
225,NMD_R1 Shoes,150,3,Very comfortable,this is my new go to sneaker. so comfortable. just love them,Nance ," June 11, 2023 ",False,True
226,NMD_R1 Shoes,150,3,Love them,"I love these shoes! They are super stylish and I get tons of compliments, but they are also very comfortable. I have wide feet and some foot issues from dancing where I can't have pressure on my big toe joint - and these are great for that. Other athletic shoes have stitching and other things that make certain parts of the shoe too tight, but not these. Of course, Adidas sizing is just strange so definitely be sure to measure your foot and use their size chart - do NOT order your normal U.S. size.",dnc619 ," June 11, 2023 ",False,True
227,NMD_R1 Shoes,150,3,The most disgusting Unboxing of my life,"The shoes came with very very clear signs of use, I just can not understand how a company like adidas allows this to be happening.  It is clear that someone try this shoes before and send them back to adidas, but the unreal part is that adidas sold this shoes to me with not even an inspection of the condition of the shoes. ¿HOW IS THIS POSIBLE?
By the way I have a video proof because I was recording the unboxing.",Sneakerkickslab ," June 11, 2023 ",True,True
228,NMD_R1 Shoes,150,3,It was okay,Yeezys are better than this model. These are not yet collectible.,KG31 ," June 11, 2023",False,False
229,NMD_R1 Shoes,150,3,Love color,Overall I love the shoe but would order a half size smaller for better fit.,TheSoloist ," June 10, 2023",False,False
230,NMD_R1 Shoes,150,3,Wife loves these shoes!,Got these for wife s bday and now she only wears these.,RoyT ," June 10, 2023",False,False
231,NMD_R1 Shoes,150,3,Okay,"They are comfortable in the sole, but the back rubs and I’m scared they will cause blisters, so I have to buy band aid to try and protect it before I wear them again.",Janet ," June 10, 2023 ",False,True
232,NMD_R1 Shoes,150,3,"They’re awesome, perfect fit and super comfortable","I like the different color option, they look really great.",Llano88 ," June 8, 2023",False,False
233,NMD_R1 Shoes,150,3,New favorite shoe,The back of the shoe sits a little high on my foot but other than that I love them.,Laura ," June 8, 2023 ",False,True
234,NMD_R1 Shoes,150,3,I was very happy with the quality and look of them,"I truly did enjoy how the shoes fit, and they are very comfortable to wear while working out or just walking around.",jreyes ," June 8, 2023",False,False
235,NMD_R1 Shoes,150,3,these are supposed to be durable and reliable,"Brand new, put one one cinched up the laces and the strip that holds the eyelets ripped straight off. these are 150.00$. I didnt even get to put the other shoe on let alone walk around in them. I love Adidas for walking, running and excersize for many, many years. :-(",suzanne ," June 7, 2023 ",True,True
236,NMD_R1 Shoes,150,3,Sizing Issue,"This shoe HAS TO BE sized incorrectly, I've had to return them for a whole size smaller and could still probably size down another half size. I wear a 7.5 in ON shoes and 7.5 in other Adidas Cloudfoam and ended up with a 6.5 in this NMD, should have went for a 6 because it still feels to big but the hassle of returning is an inconvenience. The shoe seems stiff and the support seems very thin. The only positive thing I would say is the shoe is cute, I only bought for the animal print.",Fe1210 ," June 7, 2023",False,False
239,NMD_R1 Shoes,150,3,Happy with purchase!,Perfect color for summer. Subtle and not too bright. I purchased true to size. Didn't have to size up or down and they fit great. Very comfortable and easy to wear.,Kiel42 ," June 7, 2023 ",False,True
240,NMD_R1 Shoes,150,3,"I love these shoes so much, I bought two pair!","I love these shoes so much, I bought them in black and white!",Heather ," June 7, 2023",False,False
241,NMD_R1 Shoes,150,3,Literally fav daily shoe,It’s so stylish and comfy matches everything and so comfy I wear daily,Jayjaej ," June 7, 2023",False,False
242,NMD_R1 Shoes,150,3,Overall good purchase,"Love the pattern
I have wide feet and I have no problems putting on or getting off. Nice and comfy.",Nich ," June 7, 2023",False,False
243,NMD_R1 Shoes,150,3,great shoe,got for my girlfriend she loved it. it fit her great.,ryry ," June 6, 2023",False,False
244,NMD_R1 Shoes,150,3,It was a very good gift for my girlfriend,I got it for me and my girlfriends one year anniversary and she loved them,BoofedCic ," June 6, 2023",False,False
245,NMD_R1 Shoes,150,3,Great purchase,"I love the color of the shoe, style and it's very comfortable.",Karen72 ," June 6, 2023 ",False,True
246,NMD_R1 Shoes,150,3,Perfect,"The color and style, they don't make your feet look big. They are light and airy, very comfortable.",Mindz ," June 6, 2023 ",False,True
247,NMD_R1 Shoes,150,3,Great shoe and extremely comfortable.,The shoe feels great and the color is eye catching.,Grandioso ," June 6, 2023",False,False
248,NMD_R1 Shoes,150,3,My gf loves them!!,Bought them for my gf. She says they are very comfortable,Italianmonkey ," June 6, 2023",False,False
249,NMD_R1 Shoes,150,3,Comfy shoes!,Super comfy. I normally wear an 8-1/2 or 9 and the 8 fit just right. Great tennies,honey ," June 6, 2023 ",False,True
250,NMD_R1 Shoes,150,3,Pretty good shoe,"The product is light, could use more interior padding for wear and tear over time",Wesley69 ," June 5, 2023",False,False
251,NMD_R1 Shoes,150,3,They’re grrrrreat,Love them  so much. Great style for everyday comfort,GangShit ," June 5, 2023",False,False
252,NMD_R1 Shoes,150,3,Opening to small and already worn,"I have a skinny foot and the opening of the shoe was too tight, it took a lot of effort to get the shoe on my foot. I didn't even attempt the other shoe. When I got the shoes, there was grass inside. Someone had already tried them on and obviously returned them. There was also dirt marks near the top of the shoe. The shoes were made of a hard plastic like material, not comfortable around the ankle at all. The sole of the shoe was good, but the rest was not. I had to return them. I paid too much to have uncomfortable shoes that someone had already worn.",KatieJay ," June 4, 2023",False,False
253,NMD_R1 Shoes,150,3,Best purchase,Comfortable and beautiful style love it nmd collection,Lulu ," June 4, 2023",False,False
254,NMD_R1 Shoes,150,3,They’re super cute and comfy for the gym,"Definitely would recommend 
They’re super comfortable and cute all at the same time !",Dayzzz94 ," June 4, 2023",False,False
255,NMD_R1 Shoes,150,3,I love these they are super comfortable,I have small wide feet and these fit perfect they don’t squeeze my foot at all in the front,Brooklyn16 ," June 3, 2023",False,False
256,NMD_R1 Shoes,150,3,Hard to get on Stiff fabric tongue cuts leg,Love the look but my originals from 3 years ago were softer.,Shell ," June 3, 2023",False,False
259,NMD_R1 Shoes,150,3,Very disappointed,These are at least one size too big.  I ordered the same size in a different style and it fit perfectly.,CG23 ," June 2, 2023 ",True,True
