,Title,Price,ColoursAvailable,ReviewTopic,Reviews,UserID,Date,VerifiedPurchaser,IncentivizedReview
170,Samba Classic,90,2,Affordable and stylish,Goes well with everything and is easy to match with clothes I own,Ace10 ," July 13, 2023 ",False,True
171,Samba Classic,90,2,Amazing,"It was very comfortable, they work very well for my basketball games",Lexi ," July 13, 2023",False,False
172,Samba Classic,90,2,Surprisingly comfortable,Greatttttttttttttttttttttttttttttttttttttttttttttt,Nycwalker ," July 12, 2023",False,False
173,Samba Classic,90,2,fits well and looks great on my feet.,feel great and comfy on my feet and it goes with everything in my wardrobe.,oharris ," July 12, 2023 ",True,True
174,Samba Classic,90,2,"Wow, what a great pair of shoes.",My everyday wear. I never leave the house without them.,Pooks ," July 12, 2023",False,False
175,Samba Classic,90,2,Is ok for indoor soccer,Good quality for this price the shoes is good cuality is ok,Robles21 ," July 12, 2023",False,False
176,Samba Classic,90,2,I look sexy in them,"They match everything no matter what you wear, perfect for every occasion",Kami ," July 11, 2023",False,False
177,Samba Classic,90,2,Perfect shoes love them,They fit perfect and very comfortable and great for summer,Nounou ," July 11, 2023",False,False
178,Samba Classic,90,2,Best flat-soled shoes for all activity.,"I am an old skateboarder. I don’t mean I picked up a skateboard when I got old - I’ve actually been skating since I was 7 or 8 years old thanks to my first grade teacher, Mrs. Anderson, having shown our classroom the movie about the Signal Hill downhill race from 1976 or 1977, when the movie was new. I have no earthly idea how an elementary school teacher got hold of a brand new film to show our class, but I digress. The point is I’ve been skating for about 45 years and have a host of injuries for which I’ve been treated and I needed some good, stabile shoes that don’t look silly (not that there’s anything wrong with that, but at my age…). 

I like most of Adidas’ skateboarding line (especially the Busenitz) however the Sambas have always held a special place in my mind - they’re classic and were made for running on the flat, level pitch, and lately, I’ve needed to avoid loads of young kids on scooters - running out has become more frequent than landing anything. As in the 80s, shoes designed for lateral stability (side to side) while running (e.g., Sambas / back and forth) make great skate shoes - I can feel my board but don’t feel pain after I run out. Since they’re so classic-looking, at least I look good running out. ;-)",oldkookskater ," July 11, 2023",False,False
179,Samba Classic,90,2,Not a comfortable wear over 2 hrs. I’m returning.,"The shoe is cute and I like them however if you have to wear them for more than 2 hours just casually walking for a date night, school day or something like that. The samba is not comfortable.",Didntworkout ," July 10, 2023",False,False
180,Samba Classic,90,2,Really basic essential shoe,Really good essential especially to stray apart from the regular short tongue samba,JRDP ," July 10, 2023",False,False
181,Samba Classic,90,2,"Great purchase, goes with everything.","Love the suede, feels great. The way the tongue is also really good.",gimpvvs ," July 10, 2023",False,False
182,Samba Classic,90,2,Great shoe,Very durable can last being used on field and then for casual use.,Elacostado ," July 9, 2023",False,False
183,Samba Classic,90,2,Great shoe for the price,Comfortable everyday shoe.no complaints. Love the color way.,Jdkiss05 ," July 9, 2023 ",False,True
184,Samba Classic,90,2,Very comfortable shoe to play indoor football in,"Lasts a long time, comfortable, and extremely inexpensive, recommend",zarraga ," July 8, 2023",False,False
185,Samba Classic,90,2,Perfect,The confort and quality of the materials...  very good clasico shoes,Luislggt ," July 8, 2023 ",True,True
186,Samba Classic,90,2,"It’s an amazing shoe, it’s easy to style",It’s comfortable for how thin the shoe looks and designed,luis072 ," July 8, 2023",False,False
187,Samba Classic,90,2,Most versatile shoe,Good to play indoor and also wear as a lifestyle shoe.,bamziy ," July 7, 2023 ",False,True
188,Samba Classic,90,2,Comfortable once broken in. Initially narrow toes,These are great shoes! Materials feel like a good quality. Like how it looks  initially thought I would return them because they felt very narrow in the toe box area. But after a few wears stretched out and molded to a comfortable feel. Would recommend buying.,Genny6 ," July 6, 2023",False,False
189,Samba Classic,90,2,good purchase,good color and the leather has good texture and the insole comfortable,kevin ," July 6, 2023",False,False
190,Samba Classic,90,2,Good comfortable shoes but a little narrow,Shoes look great and are decently comfortable but they they run on the narrow end. Anyone who doesn’t have narrow feet will need to go half a size up,Euphemus ," July 6, 2023",False,False
191,Samba Classic,90,2,Very good buy.,Very easy and convenient way to purchase shoes. Simple,Lime ," July 5, 2023",False,False
192,Samba Classic,90,2,I’ve been wanting these forever! Great purchase,This shoe has been on my wishlist for a while but have always been sold out. Now that I have them I love them so much. One of my favorite shoes in my closet,God’sFavorite ," July 5, 2023",False,False
193,Samba Classic,90,2,Can’t go wrong with the classics,Meant for indoor footy use but they’re comfortable enough to wear casually,Ronny ," July 5, 2023",False,False
194,Samba Classic,90,2,best shoe ever,"very comfortable and stylish shoe, probably my favorite for life",luco98 ," July 4, 2023",False,False
195,Samba Classic,90,2,My dad loved them.,"My dad grew up with these shoes, he was thrilled when I bought him a pair for father's day.",ALX21 ," July 3, 2023 ",True,True
196,Samba Classic,90,2,Exactly what I wanted.,Exactly what I wanted. They fit perfectly and they look so good!,Visabas97 ," July 3, 2023 ",True,True
197,Samba Classic,90,2,Great shoe,Great! Shoe fit perfect and the it was very comfortable.,JBbrian ," July 3, 2023",False,False
198,Samba Classic,90,2,Wore nothing but these shoes for 5 years.,"These are the most comfortable shoes I have ever worn. Wearing these, I can leave work and immediately play a game of Football. The best part is, they remain comfortable in any scenario.",MadMann ," July 3, 2023",False,False
199,Samba Classic,90,2,shoes were comfy,shoes were comfy and definitely help support when playing soccer,andy ," July 2, 2023",False,False
200,Samba Classic,90,2,"Tongue is the only annoying part, but its ok.",its good because I needed a shoe like this and it has been working well for me.,Leo123 ," July 2, 2023 ",False,True
201,Samba Classic,90,2,they are comfortable but the issue is they lookbig,once they are on their look big but fit fine which is a little weird. they are also very low to the ground which is comfortable for me at least,fc123 ," July 2, 2023",False,False
207,Samba Classic,90,2,To narrow.,The Samba Shoes are to tight and my feet hurts . How can I get a better fit? My size is 9.5 and this pair of shoes are very tight.,OM433 ," June 29, 2023 ",True,True
208,Samba Classic,90,2,very good and comfy,i really liked these shoes. They're nice and go with everything,nani2007 ," June 29, 2023",False,False
209,Samba Classic,90,2,Greta prduct very comfortable,"Love the classic Zamba  
Highly recommend 
Dont wait",Usedshoes ," June 29, 2023",False,False
210,Samba Classic,90,2,Love my shoes,"They are amazing, they look like I wanted and better",Yoshi1987 ," June 29, 2023",False,False
211,Samba Classic,90,2,Love the color and are a classic,It goes as with a lot of fits. And it also has a clean look to it,Mamon ," June 29, 2023",False,False
212,Samba Classic,90,2,Cool model and very good quality,"I like how the tongue is, and the employees were nice",,,False,False
213,Samba Classic,90,2,"Slick shoes, really enjoy them",I’m happy a got ‘em! Chill to dance in too!! Gum soles are great!!,,,False,False
214,Samba Classic,90,2,Good everyday shoe,"Good everyday shoe pt.2 
Getting a pair is worth the money",,,False,False
215,Samba Classic,90,2,Great shoe.,"Good quality, and amazing retro style, perfect for anything",,,False,False
216,Samba Classic,90,2,Samba Classic!!!,Love these Samba's!!! Great twist on a classic profile!!!,,,False,False
0,NMD_S1 Shoes,90,9,Great looking shoe and super comfortable,"Best looking NMD in my opinion, great quality and a fabulous design",,,False,False
1,NMD_S1 Shoes,90,9,My favorite shoes that l bought from Adidas,"Great product, real size ,perfect width l would definitely recommend it",,,False,False
2,NMD_S1 Shoes,90,9,Would but again,I likey … always wanted a pair and they dropped so low I had to,,,False,False
3,NMD_S1 Shoes,90,9,"Like walking on clouds, but it's a bit heavy","I love these shoes! I bought a half size down (US size), but they fit well. The NMS S1s feel like walking on clouds, but the you can feel the weight of the shoe. But I've worn them for hrs and dint feel much fatigue.",,,False,False
4,NMD_S1 Shoes,90,9,Beauty is pain.,"Great shoes for fashion. Unfortunately, this brings ""beauty is pain"" back in fashion. Don't get me wrong. These are great looking sneakers. It's just unfortunate that I would experience discomfort in the first 2 hours of wearing them, and outright pain when I wore them for a full work day the one time I did.",,,False,False
5,NMD_S1 Shoes,90,9,One of my best purchases!,Love the style on these kicks!! I work 10 hours on feet and would recommend. I have them in black and grey. Will purchase more colors.,,,False,False
6,NMD_S1 Shoes,90,9,the NMD S1 is probably the best NMD version ever,Order an 1/2 down for the perfect fit even for the wide footer,,,False,False
7,NMD_S1 Shoes,90,9,A great sneaker. Very comfortable and stylish,"Very stylish, comfortable and well made. It’s also great to have grip.",,,False,False
8,NMD_S1 Shoes,90,9,Quality Matters,"Great Shoes,  very comfortable and cushy. I would highly recommend",,,False,False
9,NMD_S1 Shoes,90,9,2nd pair of nmd s1,I love the style. I'm always on the lookout for different colors.,,,False,False
10,NMD_S1 Shoes,90,9,NMD1 all black will be most likely my new favorite,"This is easily going to become my new daily wear! Love the color, the comfort, and the look!",,,False,False
11,NMD_S1 Shoes,90,9,Very happy with quality and pricing.,"Was expecting the fancy NMD_S1 box that many other buyers received, but otherwise incredibly happy with purchase.",,,False,False
25,NMD_S1 Shoes,90,9,Perfect,Very comfortable and the design is crazy cool to see.,,,False,False
26,NMD_S1 Shoes,90,9,Very stylish and comfortable.,Great silhouette and sole makes them unique. Love the color .,,,False,False
27,NMD_S1 Shoes,90,9,Very well made &amp; comfortable,"Great shoe, comfortable, stylish, worth it, enjoy!",,,False,False
28,NMD_S1 Shoes,90,9,"Shoes is coming off my foot, could be due thinfoot","Overall looks nice feel nice, but as you wear and walk, shoes is slipping off the foot from behind. The back support and the overall height of the shoe neck could have been little lengthier than what it is. 

Reason for shoe going off the foot: I figure it’s due to the weight of the shoe and less contact support at the behind part of the foot.  May be fit approximately for little thick foot",,,False,False
29,NMD_S1 Shoes,90,9,Nmd line feel like clouds on your feet.,Concept and design are futuristic and the comfort is cloud like.,,,False,False
30,NMD_S1 Shoes,90,9,Low heel support and feels like walking uphill,Heel need more cushion and support. Rubber sole casing too bulky.,,,False,False
31,NMD_S1 Shoes,90,9,Pretty good,Clean colors and an overall nice shape on the shoes,,,False,False
0,Nizza Platform Shoes,75,6,Best pair of sneakers EVER!,My favorite of all time! So comfortable and look amazing!,Penelope ," September 14, 2023 ",True,True
1,Nizza Platform Shoes,75,6,The size is too big for actual one,Love the way of this but too wide too loose . Looks like one size larger.,Lily ," September 14, 2023",False,False
2,Nizza Platform Shoes,75,6,Cute and versatile shoe,"Love the look of this shoe, super cute and goes with everything. The only reason I gave one star less is because the shoe slides off a bit at the heel (I don't need a smaller size, it would be too small). You just have to make sure to tie your laces tight and it should be good. I also had to size down my normal US size.",Eed3 ," September 13, 2023",False,False
3,Nizza Platform Shoes,75,6,Good buy!,Not terribly comfortable out of the box. Need some breaking in. But otherwise exactly what she was looking for,ADro ," September 13, 2023 ",True,True
4,Nizza Platform Shoes,75,6,Perfect fit &amp; oh so cute!,"These are my 2nd pair of Nizza platforms and I LOVE them! Comfortable, and stylish! The colors are so feminine and  soft. Many compliments!",QueenB ," September 13, 2023 ",False,True
5,Nizza Platform Shoes,75,6,Third pair!!,Very comfortable and stylish. This is a great staple to have and versatile with pants or a sundress!! Love it!!,NEGG13 ," September 12, 2023",False,False
6,Nizza Platform Shoes,75,6,Love them so much.,I love the platform on these. They are a stylish show.,Shesn2tony ," September 12, 2023 ",True,True
7,Nizza Platform Shoes,75,6,I absolutely love them,10000000/10 would recommend. Some of the best that I have received,DariusShakur ," September 11, 2023",False,False
8,Nizza Platform Shoes,75,6,Runs small. Size up.,I sized up still too small..returned for smaller size,Queen ," September 11, 2023",False,False
9,Nizza Platform Shoes,75,6,Great purchase,These shoes are so cute and comfortable. They’re good for any occasion!,BB97 ," September 10, 2023 ",True,True
10,Nizza Platform Shoes,75,6,good platforms,they look great but the platform is not as tall as it looks in pictures,meg99 ," September 10, 2023 ",True,True
11,Nizza Platform Shoes,75,6,I love them!,They are so comfortable. Looks so cute. I can match them with everything,Naly ," September 10, 2023",False,False
17,Nizza Platform Shoes,75,6,Ran extremely too big!,Was very sad I wasn’t able to keep them because they were so cute!,Ronnie ," September 10, 2023",False,False
18,Nizza Platform Shoes,75,6,This is the most comfortable casual sneaker I have,I have low top and high top. The low top platform seem to run a tad bit smaller than the high top. Still a great sneaker!,PavlovsDog ," September 10, 2023",False,False
19,Nizza Platform Shoes,75,6,When people comment on my shoes I get happy,Fit great and look even better! Really love wearing these all around.,ENYG ," September 10, 2023 ",True,True
20,Nizza Platform Shoes,75,6,Awesome shoes!! Platform is not too high for wear,Love this shoe. Got white on white. Just bought a second pair.,Jodie ," September 9, 2023",False,False
21,Nizza Platform Shoes,75,6,One of the best purchases,Paired with the dress I ordered it’s all that. Very comfortable.,Tammy ," September 9, 2023 ",False,True
22,Nizza Platform Shoes,75,6,Great buy!,"Very nice looking platform trainer.  The interior is soft and comfortable, added bonus you get an extra pair of laces, just what I was looking for!",Twig ," September 8, 2023 ",True,True
23,Nizza Platform Shoes,75,6,Glad I finally got them!,I've been looking at these shoes for quite a while and finally decided to just get them!  So so glad I did.  Super comfy and super cute.  Classic.  The first day I wore them two different people go 'love your shoes'!!,meandgrandpajoe ," September 8, 2023 ",True,True
24,Nizza Platform Shoes,75,6,I love these shoes. They just elevate your look.,These are definitely a great addition to your collection.,Gurjeet ," September 8, 2023",False,False
25,Nizza Platform Shoes,75,6,Gorgeous kicks at a very reasonable price!,So many compliments on the color and style. Everyone wants to know where I bought them!,Mrich ," September 8, 2023",False,False
26,Nizza Platform Shoes,75,6,Stylish and cute ☺️,They are beautiful and tru to size. They are also comfortable BUT they are not made to walk long distances as they are a little heavy.,HersheyPie ," September 7, 2023",False,False
37,Nizza Platform Shoes,75,6,Beware of the fit,First off I would like to say I love adidas..: but (speaking from a person who has a troubles with their eyes) I rely on the pictures and colors and the fact that y’all sent me off white shoes and online they are white is bananas. Secondly they had a smell to them…. And it wasn’t a rubber like smell. My overall purchase was disappointing and anyone who knows me knows I model adidas for free lol but these will be sent back,DeezZadddyyy ," September 5, 2023 ",True,True
38,Nizza Platform Shoes,75,6,Stylish and comfortable,"Love the look. really comfortable. The platform performs amazing. However, if you plan on walking a lot (NYC type of thing) I recommend you break them in first. Otherwise, expect blisters at heel lever",SuperTF ," September 4, 2023 ",True,True
39,Nizza Platform Shoes,75,6,Satisfied,Great quality and sizing. Trendy and comfortable plus cost effective,ILW242 ," September 4, 2023 ",True,True
40,Nizza Platform Shoes,75,6,Love,Super comfy and looks cute with everything. I’ll be getting these in other colors.,HeatherCav ," September 4, 2023 ",True,True
41,Nizza Platform Shoes,75,6,Great shoe,"Sooooo cute and I have another pair that I love. But this pair had a sewing defect that made a buckle in the fabric. Great shoe, but this pair had a flaw.",Sudy ," September 4, 2023 ",True,True
42,Nizza Platform Shoes,75,6,The size Too small   Totally not fit.,The size Too small   Totally not fit. The size Too small   Totally not fit. The size Too small   Totally not fit. The size Too small   Totally not fit.  The size Too small   Totally not fit.,Jwluo ," September 3, 2023 ",True,True
43,Nizza Platform Shoes,75,6,💙💙💙💙💙💙💙💙💙,"It fits me perfectly, thnx you all for professional deal",Diana ," September 3, 2023 ",True,True
44,Nizza Platform Shoes,75,6,Great everyday shoe!,I love these shoes! So comfy and well made. And has extra padding in the back so no blisters.,Sammilaro ," September 3, 2023 ",True,True
45,Nizza Platform Shoes,75,6,Best versatile shoe! Wear them to work every week!,Perfect chunky shoe. Gives us shorties some extra height too :),JackAttack ," September 3, 2023",False,False
46,Nizza Platform Shoes,75,6,These shoes look great on!,"""These shoes are not only comfortable but also stylish with their fashionable platforms. I absolutely love them!""",Lowie ," September 2, 2023 ",True,True
52,Nizza Platform Shoes,75,6,Quality purchase,Purchased for my wife who absolutely loves them.  Wears them all the time. Will definitely get her another pair,Linds8379 ," September 2, 2023",False,False
53,Nizza Platform Shoes,75,6,Love them,"Comfortable and stylish, can go with so many outfits",Jesus ," September 2, 2023",False,False
54,Nizza Platform Shoes,75,6,Great purchase.,The shoes are stylish and comfortable and go with everything.,Mis05 ," September 1, 2023 ",True,True
55,Nizza Platform Shoes,75,6,Comfortable and stylish,"I loved these shoes. They're on special and nice.
Recomended!",Avik ," September 1, 2023 ",True,True
56,Nizza Platform Shoes,75,6,Love it,"Very good, comfortable, nice to wear with any outfit.",Brenda ," September 1, 2023",False,False
57,Nizza Platform Shoes,75,6,Great product,Great product! Really like my item. Will order again soon.,Leoi ," September 1, 2023",False,False
58,Nizza Platform Shoes,75,6,Super comfortable,"I like that their comfortable, easy to clean, and durable.",PZ23 ," September 1, 2023 ",True,True
59,Nizza Platform Shoes,75,6,Will buy again in another color !,Super comfortable from day one. Fit perfect. Lots of compliments.,AdidusGirl ," August 31, 2023",False,False
60,Nizza Platform Shoes,75,6,Decent,"The Adidas Nizza offers a timeless and versatile design that seamlessly blends sport and street style. Its low-top silhouette, canvas upper, and rubber toe cap provide both comfort and durability. With a clean, retro look, these sneakers are a great addition to any casual outfit, making them a popular choice among sneaker enthusiasts and fashion-conscious individuals alike.",QZLZ ," August 31, 2023",False,False
61,Nizza Platform Shoes,75,6,These shoes are perfection :),These are awesome! Sooo comfy and stylish- shipping was fast. They are my favorite shoes ever❤️,Drjo ," August 31, 2023 ",True,True
62,Nizza Platform Shoes,75,6,Best friend loves these!,Bought these for my best friend &amp; she loves them! Perfect fit &amp; she says they're super comfy also!,MendyJo ," August 30, 2023 ",True,True
63,Nizza Platform Shoes,75,6,Best purchase ever...,Goglvm m ncjfkfififuduxkxlccm m m mckckxjxkckckcjdududuxm xjkf,Wichin ," August 30, 2023",False,False
64,Nizza Platform Shoes,75,6,The price was great and I feel super comfortable,"Love the color and the fabric, and the material feel real good",Pantera ," August 30, 2023",False,False
65,Nizza Platform Shoes,75,6,It couldn't be better. Super recommend it!,"It couldn't be better. Excellent shape, comfortable, high quality and the size matches.
A perfect designer and a wonderful fit.",Tamybriggs ," August 29, 2023 ",True,True
66,Nizza Platform Shoes,75,6,Great Purchase,These shoes are very cute looking and really comfortable. I would recommend them.,Jezz ," August 29, 2023",False,False
71,Nizza Platform Shoes,75,6,Comfortable,"It is comfortable, I love it. Shoes are amazing, good materials and beautiful model",Coni2501 ," August 29, 2023",False,False
72,Nizza Platform Shoes,75,6,Perfect,It’s so cool and perfect . Recommend . This is the best,Tati ," August 29, 2023",False,False
73,Nizza Platform Shoes,75,6,Cute and comfortable,Super cute and super comfortable. I’m a shorty so it’s nice getting a few extra inches without being uncomfortable.,thuyzer ," August 29, 2023 ",True,True
74,Nizza Platform Shoes,75,6,Cool white sneaker,Matches everything!  The platform makes it a cooler styler. Don’t like the width. My foot is narrow and it’s a bit wide but still a good shoe,JenLyn2011 ," August 28, 2023 ",True,True
75,Nizza Platform Shoes,75,6,Love them!,"Super cute platform kicks. I was looking for a classic white shoe and these are perfect. True to size and comfortable.  Also, I received them in 1 day! Amazing!",Chilton922 ," August 28, 2023 ",True,True
76,Nizza Platform Shoes,75,6,Style and comfort,"These are comfortable, cute and stylish. The platforms are a bit much for me, I didn't like them in that regard. Otherwise a great fit and a good price.",DDeb ," August 28, 2023 ",True,True
87,Nizza Platform Shoes,75,6,Great shoe. Comfortable,Extremely comfortable and excellent quality.  Highly recommend,Lisa ," August 27, 2023 ",False,True
88,Nizza Platform Shoes,75,6,Beautiful,"They look stunning 🤩 I loved it, needed to tie the laces so they would feel more comfortable, I wear 9,5 but I ordered 10 and they are just perfect! So comfortable and they look a bit fancy even though they are canvas material.. I’m very happy with my purchase!",Marge ," August 27, 2023",False,False
89,Nizza Platform Shoes,75,6,Its ok,Too much of a platform shoes. Remind me of the air force,NickyRead ," August 27, 2023 ",True,True
90,Nizza Platform Shoes,75,6,"Besides digging into my ankles, great shoe","Super comfy until they started digging into the back of my ankles. Not sure if it's me, (probably is), or the shoe. Other than that, they soles are cushioned which is very nice.",MleK ," August 26, 2023",False,False
91,Nizza Platform Shoes,75,6,My wife love them and they fit better than expecte,"Better. To buy here than the Outlet, cause the ones on the outlet the size was wrong",VanChapel ," August 26, 2023",False,False
92,Nizza Platform Shoes,75,6,Love it!,Great shoes! Comfortable and cute! Would definitely recommend.,LM86 ," August 29, 2023",False,False
93,Nizza Platform Shoes,75,6,Comfortable but gotta get use to a higher shoe.,Love the colors on the shoe matches with pretty much everything.,Mar212 ," August 29, 2023",False,False
94,Nizza Platform Shoes,75,6,Comfort meets style.,SO comfortable right along with how stylish they are.,LindseyB ," August 29, 2023 ",True,True
95,Nizza Platform Shoes,75,6,Shoes that look like a sunset?  Yes please!,"These shoes are so comfortable, although I could have sized down a half size. The color is amazing!",Jess17 ," August 29, 2023",False,False
96,Nizza Platform Shoes,75,6,Nice looking casual shoes with a great subtle heel,"This shoe is comfortable, goes with everything, and makes me look taller in a casual way. Definitely worth it and want it in more colors/ styles.",Autumn ," August 29, 2023",False,False
97,Nizza Platform Shoes,75,6,Nice shoe too wide,Like the cloth design &amp; color. I will purchase another pair in the near future if I can only get my refund processed! Total nightmare when it comes to s refund,AdidasFan ," August 23, 2023",False,False
98,Nizza Platform Shoes,75,6,Love em so pretty,I love them happy I got them I got so many compliments,Pinky889 ," August 22, 2023 ",False,True
99,Nizza Platform Shoes,75,6,Best,Perfect fit and super comfortable great styles wish more colors,Chris ," August 21, 2023",False,False
100,Nizza Platform Shoes,75,6,Lovely shoes,"You need to order at least a size up.
Had to return &amp; order the plain white in size 8.",Jules212 ," August 20, 2023 ",True,True
101,Nizza Platform Shoes,75,6,Not a good fit,Cute but narrow.  Could not get my foot in them.  Had to return.,Luv4Adidias ," August 20, 2023 ",True,True
102,Nizza Platform Shoes,75,6,stylish and versatile,stylish platform design which is very comfortable to wear,CBC83 ," August 19, 2023 ",True,True
